title,href,full_url
Bagaimana memilih skincare yang aman untuk ibu hamil 6 bulan?,/komunitas/topic/bagaimana-memilih-skincare-yang-aman-untuk-ibu-hamil-6-bulan-,https://www.alodokter.com/komunitas/topic/bagaimana-memilih-skincare-yang-aman-untuk-ibu-hamil-6-bulan-
Apa yang aman digunakan untuk mengatasi jerawat saat hamil trimester pertama?,/komunitas/topic/apa-yang-aman-digunakan-untuk-mengatasi-jerawat-saat-hamil-trimester,https://www.alodokter.com/komunitas/topic/apa-yang-aman-digunakan-untuk-mengatasi-jerawat-saat-hamil-trimester
Bagaimana membedakan kram perut dan keputihan normal dengan tanda bahaya pada kehamilan 10 minggu?,/komunitas/topic/bagaimana-membedakan-kram-perut-dan-keputihan-normal-dengan-tanda-bahaya,https://www.alodokter.com/komunitas/topic/bagaimana-membedakan-kram-perut-dan-keputihan-normal-dengan-tanda-bahaya
"Kenapa sering lelah dan nafsu makan meningkat saat haid terlambat, apakah ini tanda kehamilan?",/komunitas/topic/kenapa-sering-lelah-dan-nafsu-makan-meningkat-saat-haid-terlambat-,https://www.alodokter.com/komunitas/topic/kenapa-sering-lelah-dan-nafsu-makan-meningkat-saat-haid-terlambat-
Apakah pusing kepala dan telat haid 6 hari tanda awal kehamilan?,/komunitas/topic/apakah-pusing-kepala-dan-telat-haid-6-hari-tanda-awal,https://www.alodokter.com/komunitas/topic/apakah-pusing-kepala-dan-telat-haid-6-hari-tanda-awal
Bagaimana cara aman mengatasi sakit gigi berlubang pada ibu hamil 5 bulan?,/komunitas/topic/bagaimana-cara-aman-mengatasi-sakit-gigi-berlubang-pada-ibu-hamil,https://www.alodokter.com/komunitas/topic/bagaimana-cara-aman-mengatasi-sakit-gigi-berlubang-pada-ibu-hamil
Kenapa test pack menunjukkan dua garis samar meski belum ada gejala hamil?,/komunitas/topic/kenapa-test-pack-menunjukkan-dua-garis-samar-meski-belum-ada,https://www.alodokter.com/komunitas/topic/kenapa-test-pack-menunjukkan-dua-garis-samar-meski-belum-ada
Kenapa ibu hamil 7 bulan sering mengalami kesemutan di jari tangan dan kaki?,/komunitas/topic/kenapa-ibu-hamil-7-bulan-sering-mengalami-kesemutan-di-jari,https://www.alodokter.com/komunitas/topic/kenapa-ibu-hamil-7-bulan-sering-mengalami-kesemutan-di-jari
Kenapa ibu hamil 6 bulan sering terbangun untuk pipis di malam hari?,/komunitas/topic/kenapa-ibu-hamil-6-bulan-sering-terbangun-untuk-pipis-di,https://www.alodokter.com/komunitas/topic/kenapa-ibu-hamil-6-bulan-sering-terbangun-untuk-pipis-di
Bagaimana mengatasi kaki bengkak dan nyeri punggung saat hamil kembar?,/komunitas/topic/bagaimana-mengatasi-kaki-bengkak-dan-nyeri-punggung-saat-hamil-kembar-,https://www.alodokter.com/komunitas/topic/bagaimana-mengatasi-kaki-bengkak-dan-nyeri-punggung-saat-hamil-kembar-
Apakah kram kaki malam hari umum terjadi pada ibu hamil trimester 3?,/komunitas/topic/apakah-kram-kaki-malam-hari-umum-terjadi-pada-ibu-hamil,https://www.alodokter.com/komunitas/topic/apakah-kram-kaki-malam-hari-umum-terjadi-pada-ibu-hamil
Apakah anemia pada trimester kedua kehamilan dapat menimbulkan risiko bagi janin?,/komunitas/topic/apakah-anemia-pada-trimester-kedua-kehamilan-dapat-menimbulkan-risiko-bagi,https://www.alodokter.com/komunitas/topic/apakah-anemia-pada-trimester-kedua-kehamilan-dapat-menimbulkan-risiko-bagi
Apakah ibu hamil dengan skoliosis ringan berisiko mengalami masalah saat persalinan?,/komunitas/topic/apakah-ibu-hamil-dengan-skoliosis-ringan-berisiko-mengalami-masalah-saat,https://www.alodokter.com/komunitas/topic/apakah-ibu-hamil-dengan-skoliosis-ringan-berisiko-mengalami-masalah-saat
Apa penyebab perut menjadi kencang setelah beraktivitas saat hamil 7 bulan?,/komunitas/topic/apa-penyebab-perut-menjadi-kencang-setelah-beraktivitas-saat-hamil-7,https://www.alodokter.com/komunitas/topic/apa-penyebab-perut-menjadi-kencang-setelah-beraktivitas-saat-hamil-7
Apakah flek kecokelatan saat hamil 10 minggu termasuk tanda bahaya?,/komunitas/topic/apakah-flek-kecokelatan-saat-hamil-10-minggu-termasuk-tanda-bahaya-,https://www.alodokter.com/komunitas/topic/apakah-flek-kecokelatan-saat-hamil-10-minggu-termasuk-tanda-bahaya-
Apakah janin 12 minggu sudah memiliki semua organ tubuh yang lengkap?,/komunitas/topic/apakah-janin-12-minggu-sudah-memiliki-semua-organ-tubuh-yang,https://www.alodokter.com/komunitas/topic/apakah-janin-12-minggu-sudah-memiliki-semua-organ-tubuh-yang
Bagaimana cara mengurangi nyeri payudara saat hamil 20 minggu?,/komunitas/topic/bagaimana-cara-mengurangi-nyeri-payudara-saat-hamil-20-minggu-,https://www.alodokter.com/komunitas/topic/bagaimana-cara-mengurangi-nyeri-payudara-saat-hamil-20-minggu-
Apakah kembung hampir setiap hari di awal kehamilan termasuk normal?,/komunitas/topic/apakah-kembung--hampir-setiap-hari-di-awal-kehamilan-termasuk-normal-,https://www.alodokter.com/komunitas/topic/apakah-kembung--hampir-setiap-hari-di-awal-kehamilan-termasuk-normal-
Apa yang menyebabkan perut begah saat hamil muda?,/komunitas/topic/apa-yang-menyebabkan-perut-begah-saat-hamil-muda-,https://www.alodokter.com/komunitas/topic/apa-yang-menyebabkan-perut-begah-saat-hamil-muda-
Bagaimana cara mengatasi perut kembung saat hamil 8 minggu?,/komunitas/topic/bagaimana-cara-mengatasi-perut-kembung-saat-hamil-8-minggu-,https://www.alodokter.com/komunitas/topic/bagaimana-cara-mengatasi-perut-kembung-saat-hamil-8-minggu-
Apa masih bisa hamil jika berhubungan setelah masa ovulasi?,/komunitas/topic/apa-masih-bisa-hamil-jika-berhubungan-setelah-masa-ovulasi-,https://www.alodokter.com/komunitas/topic/apa-masih-bisa-hamil-jika-berhubungan-setelah-masa-ovulasi-
"Hamil 7 bulan, tekanan darah tinggi dan kaki bengkak, apakah ini tanda preeklamsia?",/komunitas/topic/hamil-7-bulan--tekanan-darah-tinggi-dan-kaki-bengkak--apa,https://www.alodokter.com/komunitas/topic/hamil-7-bulan--tekanan-darah-tinggi-dan-kaki-bengkak--apa
Apakah berhubungan dengan suami di awal kehamilan bisa membahayakan janin?,/komunitas/topic/apakah-berhubungan-dengan-suami-di-awal-kehamilan-bisa-membahayakan-janin-,https://www.alodokter.com/komunitas/topic/apakah-berhubungan-dengan-suami-di-awal-kehamilan-bisa-membahayakan-janin-
Apa saja makanan sehat untuk trimester pertama?,/komunitas/topic/apa-saja-makanan-sehat-untuk-trimester-pertama-,https://www.alodokter.com/komunitas/topic/apa-saja-makanan-sehat-untuk-trimester-pertama-
Apa tips agar perut nyaman saat hamil trimester pertama?,/komunitas/topic/apa-tips-agar-perut-nyaman-saat-hamil-trimester-pertama-,https://www.alodokter.com/komunitas/topic/apa-tips-agar-perut-nyaman-saat-hamil-trimester-pertama-
Apa yang harus dilakukan sebelum USG kehamilan 6 bulan agar janin terlihat jelas?,/komunitas/topic/tips-agar-hasil-usg-jelas-apa-ya-dok-,https://www.alodokter.com/komunitas/topic/tips-agar-hasil-usg-jelas-apa-ya-dok-
Cara aman menurunkan tekanan darah tinggi pada ibu hamil 7 bulan dengan kaki bengkak?,/komunitas/topic/hamil-7-bulan-tensi-160--bahaya-gak-ya-dok-dan,https://www.alodokter.com/komunitas/topic/hamil-7-bulan-tensi-160--bahaya-gak-ya-dok-dan
Apakah nyeri perut dan keputihan saat hamil 5 bulan berbahaya?,/komunitas/topic/apakah-nyeri-perut-dan-keputihan-saat-hamil-5-bulan-berbahaya-,https://www.alodokter.com/komunitas/topic/apakah-nyeri-perut-dan-keputihan-saat-hamil-5-bulan-berbahaya-
Berapa dosis asam folat yang disarankan untuk ibu hamil di trimester pertama?,/komunitas/topic/berapa-dosis-asam-folat-yang-disarankan-untuk-ibu-hamil-di,https://www.alodokter.com/komunitas/topic/berapa-dosis-asam-folat-yang-disarankan-untuk-ibu-hamil-di
Wajar atau tidak bila perut terasa kencang saat hamil 9 minggu?,/komunitas/topic/wajar-atau-tidak-bila-perut-terasa-kencang-saat-hamil-9,https://www.alodokter.com/komunitas/topic/wajar-atau-tidak-bila-perut-terasa-kencang-saat-hamil-9
Berapa lama proses melahirkan dimulai setelah muncul flek tanda persalinan?,/komunitas/topic/berapa-lama-proses-melahirkan-dimulai-setelah-muncul-flek-tanda-persalinan-,https://www.alodokter.com/komunitas/topic/berapa-lama-proses-melahirkan-dimulai-setelah-muncul-flek-tanda-persalinan-
Kapan waktu terbaik untuk tes kehamilan setelah muncul tanda awal kehamilan?,/komunitas/topic/kapan-waktu-terbaik-untuk-tes-kehamilan-setelah-muncul-tanda-awal,https://www.alodokter.com/komunitas/topic/kapan-waktu-terbaik-untuk-tes-kehamilan-setelah-muncul-tanda-awal
Kenapa punggung saya sakit terus selama hamil?,/komunitas/topic/kenapa-punggung-saya-sakit-terus-selama-hamil-,https://www.alodokter.com/komunitas/topic/kenapa-punggung-saya-sakit-terus-selama-hamil-
Seberapa ideal kenaikan berat badan ibu hamil saat usia kandungan 35 minggu?,/komunitas/topic/seberapa-ideal-kenaikan-berat-badan-ibu-hamil-saat-usia-kandungan,https://www.alodokter.com/komunitas/topic/seberapa-ideal-kenaikan-berat-badan-ibu-hamil-saat-usia-kandungan
Kenapa pinggang belakang terasa nyeri terus selama hamil?,/komunitas/topic/kenapa-pinggang-belakang-terasa-nyeri-terus-selama-hamil-,https://www.alodokter.com/komunitas/topic/kenapa-pinggang-belakang-terasa-nyeri-terus-selama-hamil-
Gaya berhubungan yang aman untuk ibu hamil 8 bulan?,/komunitas/topic/gaya-berhubungan-yang-aman-untuk-ibu-hamil-8-bulan-,https://www.alodokter.com/komunitas/topic/gaya-berhubungan-yang-aman-untuk-ibu-hamil-8-bulan-
Jenis ikan apa yang aman dikonsumsi ibu hamil?,/komunitas/topic/jenis-ikan-apa-yang-aman-dikonsumsi-ibu-hamil-,https://www.alodokter.com/komunitas/topic/jenis-ikan-apa-yang-aman-dikonsumsi-ibu-hamil-
Kenapa ibu hamil sering merasakan nyeri di bagian pinggang belakang?,/komunitas/topic/kenapa-ibu-hamil-sering-merasakan-nyeri-di-bagian-pinggang-belakang-,https://www.alodokter.com/komunitas/topic/kenapa-ibu-hamil-sering-merasakan-nyeri-di-bagian-pinggang-belakang-
Apakah aman berhubungan intim saat hamil?,/komunitas/topic/apakah-aman-berhubungan-intim-saat-hamil-,https://www.alodokter.com/komunitas/topic/apakah-aman-berhubungan-intim-saat-hamil-
Apakah normal belum merasakan kontraksi kuat padahal usia kandungan sudah 39 minggu?,/komunitas/topic/apakah-normal-belum-merasakan-kontraksi-kuat-padahal-usia-kandungan-sudah,https://www.alodokter.com/komunitas/topic/apakah-normal-belum-merasakan-kontraksi-kuat-padahal-usia-kandungan-sudah
Bagaimana cara mengatasi sembelit saat hamil?,/komunitas/topic/bagaimana-cara-mengatasi-sembelit-saat-hamil-,https://www.alodokter.com/komunitas/topic/bagaimana-cara-mengatasi-sembelit-saat-hamil-
Makanan apa yang sebaiknya dikonsumsi pada awal kehamilan?,/komunitas/topic/makanan-apa-yang-sebaiknya-dikonsumsi-pada-awal-kehamilan-,https://www.alodokter.com/komunitas/topic/makanan-apa-yang-sebaiknya-dikonsumsi-pada-awal-kehamilan-
Apa saja ciri kehamilan di usia 1 minggu?,/komunitas/topic/apa-saja-ciri-kehamilan-di-usia-1-minggu-,https://www.alodokter.com/komunitas/topic/apa-saja-ciri-kehamilan-di-usia-1-minggu-
Gejala apa saja yang masih dianggap normal saat hamil 5 bulan?,/komunitas/topic/gejala-apa-saja-yang-masih-dianggap-normal-saat-hamil-5,https://www.alodokter.com/komunitas/topic/gejala-apa-saja-yang-masih-dianggap-normal-saat-hamil-5
Bagaimana kehamilan bisa terjadi meski tidak merencanakan?,/komunitas/topic/bagaimana-kehamilan-bisa-terjadi-meski-tidak-merencanakan-,https://www.alodokter.com/komunitas/topic/bagaimana-kehamilan-bisa-terjadi-meski-tidak-merencanakan-
Bagaimana cara memastikan bayi 5 bulan dalam kandungan sehat?,/komunitas/topic/bagaimana-cara-memastikan-bayi-5-bulan-dalam-kandungan-sehat-,https://www.alodokter.com/komunitas/topic/bagaimana-cara-memastikan-bayi-5-bulan-dalam-kandungan-sehat-
Apakah janin usia 23 minggu sudah bisa mendengar suara dari luar perut?,/komunitas/topic/apakah-janin-usia-23-minggu-sudah-bisa-mendengar-suara-dari,https://www.alodokter.com/komunitas/topic/apakah-janin-usia-23-minggu-sudah-bisa-mendengar-suara-dari
Apakah nyeri ringan di perut bawah saat hamil 32 minggu masih tergolong normal?,/komunitas/topic/apakah-nyeri-ringan-di-perut-bawah-saat-hamil-32-minggu,https://www.alodokter.com/komunitas/topic/apakah-nyeri-ringan-di-perut-bawah-saat-hamil-32-minggu
Apakah bisa hamil jika sperma mengenai area vagina tanpa penetrasi?,/komunitas/topic/apakah-bisa-hamil-jika-sperma-mengenai-area-vagina-tanpa-penetrasi-,https://www.alodokter.com/komunitas/topic/apakah-bisa-hamil-jika-sperma-mengenai-area-vagina-tanpa-penetrasi-
Apakah berat janin 36 minggu yang di atas rata-rata normal?,/komunitas/topic/apakah-berat-janin-36-minggu-yang-di-atas-rata-rata-normal-,https://www.alodokter.com/komunitas/topic/apakah-berat-janin-36-minggu-yang-di-atas-rata-rata-normal-
Benarkah ibu hamil tidak boleh memelihara kucing?,/komunitas/topic/benarkah-ibu-hamil-tidak-boleh-memelihara-kucing-,https://www.alodokter.com/komunitas/topic/benarkah-ibu-hamil-tidak-boleh-memelihara-kucing-
Bolehkah tetap berhubungan intim di trimester ketiga kehamilan?,/komunitas/topic/bolehkah-tetap-berhubungan-intim-di-trimester-ketiga-kehamilan-,https://www.alodokter.com/komunitas/topic/bolehkah-tetap-berhubungan-intim-di-trimester-ketiga-kehamilan-
Vitamin apa yang sebaiknya dikonsumsi untuk program hamil?,/komunitas/topic/vitamin-apa-yang-sebaiknya-dikonsumsi-untuk-program-hamil-,https://www.alodokter.com/komunitas/topic/vitamin-apa-yang-sebaiknya-dikonsumsi-untuk-program-hamil-
Obat batuk apa yang aman untuk ibu hamil 5 bulan?,/komunitas/topic/obat-batuk-apa-yang-aman-untuk-ibu-hamil-5-bulan-,https://www.alodokter.com/komunitas/topic/obat-batuk-apa-yang-aman-untuk-ibu-hamil-5-bulan-
Apakah makan pisang aman untuk ibu hamil?,/komunitas/topic/apakah-makan-pisang-aman-untuk-ibu-hamil-,https://www.alodokter.com/komunitas/topic/apakah-makan-pisang-aman-untuk-ibu-hamil-
Apakah protein urine positif 1 saat hamil termasuk kondisi berbahaya?,/komunitas/topic/apakah-protein-urine-positif-1-saat-hamil-termasuk-kondisi-berbahaya-,https://www.alodokter.com/komunitas/topic/apakah-protein-urine-positif-1-saat-hamil-termasuk-kondisi-berbahaya-
Amankah ketan hitam dikonsumsi saat usia kehamilan 5 bulan?,/komunitas/topic/amankah-ketan-hitam-dikonsumsi-saat-usia-kehamilan-5-bulan-,https://www.alodokter.com/komunitas/topic/amankah-ketan-hitam-dikonsumsi-saat-usia-kehamilan-5-bulan-
Kenapa muncul flek di usia kehamilan 6 minggu?,/komunitas/topic/kenapa-muncul-flek-di-usia-kehamilan-6-minggu-,https://www.alodokter.com/komunitas/topic/kenapa-muncul-flek-di-usia-kehamilan-6-minggu-
"Hubungan suami istri di usia kehamilan 4 minggu, apakah berbahaya?",/komunitas/topic/hubungan-suami-istri-di-usia-kehamilan-4-minggu--apakah-berbahaya-,https://www.alodokter.com/komunitas/topic/hubungan-suami-istri-di-usia-kehamilan-4-minggu--apakah-berbahaya-
Apakah bisa hamil jika haid hanya berlangsung satu hari?,/komunitas/topic/apakah-bisa-hamil-jika-haid-hanya-berlangsung-satu-hari-,https://www.alodokter.com/komunitas/topic/apakah-bisa-hamil-jika-haid-hanya-berlangsung-satu-hari-
"Mengapa muncul keinginan makan aneh dan mual di pagi hari, apakah itu tanda hamil?",/komunitas/topic/mengapa-muncul-keinginan-makan-aneh-dan-mual-di-pagi-hari-,https://www.alodokter.com/komunitas/topic/mengapa-muncul-keinginan-makan-aneh-dan-mual-di-pagi-hari-
Mengapa haid bisa telat dan bagaimana cara mempercepat datangnya menstruasi?,/komunitas/topic/mengapa-haid-bisa-telat-dan-bagaimana-cara-mempercepat-datangnya-menstruasi-,https://www.alodokter.com/komunitas/topic/mengapa-haid-bisa-telat-dan-bagaimana-cara-mempercepat-datangnya-menstruasi-
Apakah flek coklat setelah berhubungan bisa menjadi tanda hamil?,/komunitas/topic/apakah-flek-coklat-setelah-berhubungan-bisa-menjadi-tanda-hamil-,https://www.alodokter.com/komunitas/topic/apakah-flek-coklat-setelah-berhubungan-bisa-menjadi-tanda-hamil-
Apakah denyut nadi yang cepat saat hamil termasuk normal?,/komunitas/topic/apakah-denyut-nadi-yang-cepat-saat-hamil-termasuk-normal-,https://www.alodokter.com/komunitas/topic/apakah-denyut-nadi-yang-cepat-saat-hamil-termasuk-normal-
Apakah normal perut sering kencang saat hamil 5 bulan?,/komunitas/topic/apakah-normal-perut-sering-kencang-saat-hamil-5-bulan-,https://www.alodokter.com/komunitas/topic/apakah-normal-perut-sering-kencang-saat-hamil-5-bulan-
Apakah petting bisa menyebabkan kehamilan meskipun tanpa penetrasi?,/komunitas/topic/apakah-petting-bisa-menyebabkan-kehamilan-meskipun-tanpa-penetrasi-,https://www.alodokter.com/komunitas/topic/apakah-petting-bisa-menyebabkan-kehamilan-meskipun-tanpa-penetrasi-
Apakah pil KB darurat masih efektif dua hari setelah berhubungan?,/komunitas/topic/apakah-pil-kb-darurat-masih-efektif-dua-hari-setelah-berhubungan-,https://www.alodokter.com/komunitas/topic/apakah-pil-kb-darurat-masih-efektif-dua-hari-setelah-berhubungan-
Apakah air mani kedua bisa menyebabkan kehamilan?,/komunitas/topic/apakah-air-mani-kedua-bisa-menyebabkan-kehamilan-,https://www.alodokter.com/komunitas/topic/apakah-air-mani-kedua-bisa-menyebabkan-kehamilan-
Apa penyebab punggung sakit saat kehamilan?,/komunitas/topic/apa-penyebab-punggung-sakit-saat-kehamilan-,https://www.alodokter.com/komunitas/topic/apa-penyebab-punggung-sakit-saat-kehamilan-
Bisa hamilkah kalau berhubungan intim ketika sedang mengalami flek?,/komunitas/topic/bisa-hamilkah-kalau-berhubungan-intim-ketika-sedang-mengalami-flek-,https://www.alodokter.com/komunitas/topic/bisa-hamilkah-kalau-berhubungan-intim-ketika-sedang-mengalami-flek-
Apakah normal tespek positif lalu haid datang seperti biasa?,/komunitas/topic/apakah-normal-tespek-positif-lalu-haid-datang-seperti-biasa-,https://www.alodokter.com/komunitas/topic/apakah-normal-tespek-positif-lalu-haid-datang-seperti-biasa-
Bolehkah ibu hamil mengonsumsi minuman dingin atau es?,/komunitas/topic/bolehkah-ibu-hamil-mengonsumsi-minuman-dingin-atau-es-,https://www.alodokter.com/komunitas/topic/bolehkah-ibu-hamil-mengonsumsi-minuman-dingin-atau-es-
Bagaimana cara mengatasi sesak napas saat hamil 7 bulan?,/komunitas/topic/bagaimana-cara-mengatasi-sesak-napas-saat-hamil-7-bulan-,https://www.alodokter.com/komunitas/topic/bagaimana-cara-mengatasi-sesak-napas-saat-hamil-7-bulan-
Apakah 2 garis samar pada tespek berarti hamil?,/komunitas/topic/apakah-2-garis-samar-pada-tespek-berarti-hamil-,https://www.alodokter.com/komunitas/topic/apakah-2-garis-samar-pada-tespek-berarti-hamil-
Bagaimana cara mengetahui penyebab darah segar keluar saat hamil 5 minggu?,/komunitas/topic/bagaimana-cara-mengetahui-penyebab-darah-segar-keluar-saat-hamil-5,https://www.alodokter.com/komunitas/topic/bagaimana-cara-mengetahui-penyebab-darah-segar-keluar-saat-hamil-5
Bagaimana cara mengatasi sakit perut saat hamil 7 bulan?,/komunitas/topic/bagaimana-cara-mengatasi-sakit-perut-saat-hamil-7-bulan-,https://www.alodokter.com/komunitas/topic/bagaimana-cara-mengatasi-sakit-perut-saat-hamil-7-bulan-
Bagaimana cara mengetahui telat haid 4 hari itu karena hamil atau bukan?,/komunitas/topic/bagaimana-cara-mengetahui-telat-haid-4-hari-itu-karena-hamil,https://www.alodokter.com/komunitas/topic/bagaimana-cara-mengetahui-telat-haid-4-hari-itu-karena-hamil
"Nyeri punggung hamil sampai paha, kenapa?",/komunitas/topic/nyeri-punggung-hamil-sampai-paha--kenapa-,https://www.alodokter.com/komunitas/topic/nyeri-punggung-hamil-sampai-paha--kenapa-
Bagaimana mencukupi nutrisi ibu hamil?,/komunitas/topic/bagaimana-mencukupi-nutrisi-ibu-hamil-,https://www.alodokter.com/komunitas/topic/bagaimana-mencukupi-nutrisi-ibu-hamil-
"Mual muntah parah saat hamil, normal?",/komunitas/topic/mual-muntah-parah-saat-hamil--normal-,https://www.alodokter.com/komunitas/topic/mual-muntah-parah-saat-hamil--normal-
Apakah nyeri perut bawah saat hamil normal?,/komunitas/topic/apakah-nyeri-perut-bawah-saat-hamil-normal-,https://www.alodokter.com/komunitas/topic/apakah-nyeri-perut-bawah-saat-hamil-normal-
Kenapa bagian bawah perut terasa tertarik saat hamil?,/komunitas/topic/kenapa-bagian-bawah-perut-terasa-tertarik-saat-hamil-,https://www.alodokter.com/komunitas/topic/kenapa-bagian-bawah-perut-terasa-tertarik-saat-hamil-
Kapan waktu terbaik minum pil KB darurat agar efektif mencegah kehamilan?,/komunitas/topic/kapan-waktu-terbaik-minum-pil-kb-darurat-agar-efektif-mencegah,https://www.alodokter.com/komunitas/topic/kapan-waktu-terbaik-minum-pil-kb-darurat-agar-efektif-mencegah
Kapan perut mulai membesar saat hamil?,/komunitas/topic/kapan-perut-mulai-membesar-saat-hamil-,https://www.alodokter.com/komunitas/topic/kapan-perut-mulai-membesar-saat-hamil-
"Gerakan janin terlalu sering, normal nggak ya?",/komunitas/topic/gerakan-janin-terlalu-sering--normal-nggak-ya-,https://www.alodokter.com/komunitas/topic/gerakan-janin-terlalu-sering--normal-nggak-ya-
"Perut terasa kencang saat hamil 7 bulan, normal?",/komunitas/topic/perut-terasa-kencang-saat-hamil-7-bulan--normal-,https://www.alodokter.com/komunitas/topic/perut-terasa-kencang-saat-hamil-7-bulan--normal-
Benarkah menyusui saat hamil muda bisa menyebabkan keguguran?,/komunitas/topic/benarkah-menyusui-saat-hamil-muda-bisa-menyebabkan-keguguran-,https://www.alodokter.com/komunitas/topic/benarkah-menyusui-saat-hamil-muda-bisa-menyebabkan-keguguran-
Benarkah aktivitas seksual di trimester akhir bisa memicu kontraksi?,/komunitas/topic/benarkah-aktivitas-seksual-di-trimester-akhir-bisa-memicu-kontraksi-,https://www.alodokter.com/komunitas/topic/benarkah-aktivitas-seksual-di-trimester-akhir-bisa-memicu-kontraksi-
Posisi tidur apa yang sebaiknya dihindari saat usia kehamilan masuk 5 bulan?,/komunitas/topic/posisi-tidur-apa-yang-sebaiknya-dihindari-saat-usia-kehamilan-masuk,https://www.alodokter.com/komunitas/topic/posisi-tidur-apa-yang-sebaiknya-dihindari-saat-usia-kehamilan-masuk
Apakah nyeri perut bawah saat hamil 20 minggu termasuk hal yang normal?,/komunitas/topic/apakah-nyeri-perut-bawah-saat-hamil-20-minggu-termasuk-hal,https://www.alodokter.com/komunitas/topic/apakah-nyeri-perut-bawah-saat-hamil-20-minggu-termasuk-hal
Apakah janin bisa terganggu jika berhubungan saat hamil?,/komunitas/topic/apakah-janin-bisa-terganggu-jika-berhubungan-saat-hamil-,https://www.alodokter.com/komunitas/topic/apakah-janin-bisa-terganggu-jika-berhubungan-saat-hamil-
Bagaimana cara mengatasi sakit pinggang saat hamil tanpa obat?,/komunitas/topic/bagaimana-cara-mengatasi-sakit-pinggang-saat-hamil-tanpa-obat-,https://www.alodokter.com/komunitas/topic/bagaimana-cara-mengatasi-sakit-pinggang-saat-hamil-tanpa-obat-
Apa penyebab sesak napas saat hamil meski tidak punya riwayat asma?,/komunitas/topic/apa-penyebab-sesak-napas-saat-hamil-meski-tidak-punya-riwayat,https://www.alodokter.com/komunitas/topic/apa-penyebab-sesak-napas-saat-hamil-meski-tidak-punya-riwayat
Apakah perut begah bisa mengganggu perkembangan janin di awal kehamilan?,/komunitas/topic/apakah-perut-begah-bisa-mengganggu-perkembangan-janin-di-awal-kehamilan-,https://www.alodokter.com/komunitas/topic/apakah-perut-begah-bisa-mengganggu-perkembangan-janin-di-awal-kehamilan-
Apakah flek coklat saat hamil 10 minggu itu normal?,/komunitas/topic/apakah-flek-coklat-saat-hamil-10-minggu-itu-normal-,https://www.alodokter.com/komunitas/topic/apakah-flek-coklat-saat-hamil-10-minggu-itu-normal-
Apa pilihan obat yang aman saat hamil?,/komunitas/topic/apa-pilihan-obat-yang-aman-saat-hamil-,https://www.alodokter.com/komunitas/topic/apa-pilihan-obat-yang-aman-saat-hamil-
Apakah benar kehamilan di atas 35 tahun berisiko Down Syndrome?,/komunitas/topic/apakah-benar-kehamilan-di-atas-35-tahun-berisiko-down-syndrome-,https://www.alodokter.com/komunitas/topic/apakah-benar-kehamilan-di-atas-35-tahun-berisiko-down-syndrome-
Apakah air ketuban banyak bisa menandakan masalah pada janin?,/komunitas/topic/apakah-air-ketuban-banyak-bisa-menandakan-masalah-pada-janin-,https://www.alodokter.com/komunitas/topic/apakah-air-ketuban-banyak-bisa-menandakan-masalah-pada-janin-
"Nyeri perut bawah saat hamil 6 bulan, normal nggak?",/komunitas/topic/nyeri-perut-bawah-saat-hamil-6-bulan--normal-nggak-,https://www.alodokter.com/komunitas/topic/nyeri-perut-bawah-saat-hamil-6-bulan--normal-nggak-
Apakah perubahan warna pada leher saat hamil berkaitan dengan hormon atau kondisi medis tertentu?,/komunitas/topic/apakah-perubahan-warna-pada-leher-saat-hamil-berkaitan-dengan-hormon,https://www.alodokter.com/komunitas/topic/apakah-perubahan-warna-pada-leher-saat-hamil-berkaitan-dengan-hormon
"dok, apakah air kunyit aman diminum oleh ibu hamil untuk meredakan mual dan kembung?",/komunitas/topic/dok--apakah-air-kunyit-aman-diminum-oleh-ibu-hamil-untuk,https://www.alodokter.com/komunitas/topic/dok--apakah-air-kunyit-aman-diminum-oleh-ibu-hamil-untuk
Bolehkah ibu hamil 32 minggu minum nifedipine untuk tekanan darah tinggi?,/komunitas/topic/bolehkah-ibu-hamil-32-minggu-minum-nifedipine-untuk-tekanan-darah,https://www.alodokter.com/komunitas/topic/bolehkah-ibu-hamil-32-minggu-minum-nifedipine-untuk-tekanan-darah
"Tinggi fundus saya lebih kecil dari teman yang hamil 23 minggu, apakah normal?",/komunitas/topic/tinggi-fundus-saya-lebih-kecil-dari-teman-yang-hamil-23,https://www.alodokter.com/komunitas/topic/tinggi-fundus-saya-lebih-kecil-dari-teman-yang-hamil-23
Normalkah jika posisi janin 4 bulan belum jelas saat diperiksa?,/komunitas/topic/normalkah-jika-posisi-janin-4-bulan-belum-jelas-saat-diperiksa-,https://www.alodokter.com/komunitas/topic/normalkah-jika-posisi-janin-4-bulan-belum-jelas-saat-diperiksa-
Apakah normal jika perut terasa kencang saat hamil 28 minggu?,/komunitas/topic/apakah-normal-jika-perut-terasa-kencang-saat-hamil-28-minggu-,https://www.alodokter.com/komunitas/topic/apakah-normal-jika-perut-terasa-kencang-saat-hamil-28-minggu-
Bagaimana cara mengatasi keluhan lemas yang sering terjadi saat hamil?,/komunitas/topic/bagaimana-cara-mengatasi-keluhan-lemas-yang-sering-terjadi-saat-hamil-,https://www.alodokter.com/komunitas/topic/bagaimana-cara-mengatasi-keluhan-lemas-yang-sering-terjadi-saat-hamil-
Benarkah ibu hamil 7 bulan tidak boleh makan nanas dan minum air dingin?,/komunitas/topic/benarkah-ibu-hamil-7-bulan-tidak-boleh-makan-nanas-dan,https://www.alodokter.com/komunitas/topic/benarkah-ibu-hamil-7-bulan-tidak-boleh-makan-nanas-dan
